{
  "$schema": "https://json-schema.org/draft/2020-12/schema",
  "$id": "https://forgerail.dev/schemas/return-receipt-v2.json",
  "title": "ForgeRail Return Receipt v2",
  "type": "object",
  "additionalProperties": false,
  "required": ["schemaVersion", "receiptId", "taskId", "workspaceIdentityId", "profileId", "profileRevisionId", "envelopeId", "envelopeRevisionId", "controlRevisionId", "subjectId", "phaseSliceCorrelation", "exercisedOperationGrantIds", "changedScope", "validationEvidenceIdentityIds", "externalSideEffects", "confirmedNonMutations", "residualRisks", "rollbackEnvelopeLineageId", "deviations", "claimStatus", "verificationGateResultId", "closeout", "claimedAt"],
  "properties": {
    "schemaVersion": { "const": "2.0" },
    "receiptId": { "type": "string", "pattern": "^[a-zA-Z0-9][a-zA-Z0-9._:-]+$" },
    "taskId": { "type": "string", "pattern": "^[a-zA-Z0-9][a-zA-Z0-9._:-]+$" },
    "workspaceIdentityId": { "type": "string", "pattern": "^[a-zA-Z0-9][a-zA-Z0-9._:-]+$" },
    "profileId": { "type": "string", "pattern": "^[a-zA-Z0-9][a-zA-Z0-9._:-]+$" },
    "profileRevisionId": { "type": "string", "pattern": "^[a-zA-Z0-9][a-zA-Z0-9._:-]+$" },
    "envelopeId": { "type": "string", "pattern": "^[a-zA-Z0-9][a-zA-Z0-9._:-]+$" },
    "envelopeRevisionId": { "type": "string", "pattern": "^[a-zA-Z0-9][a-zA-Z0-9._:-]+$" },
    "controlRevisionId": { "type": "string", "pattern": "^[a-zA-Z0-9][a-zA-Z0-9._:-]+$" },
    "subjectId": { "type": "string", "pattern": "^[a-zA-Z0-9][a-zA-Z0-9._:-]+$" },
    "phaseSliceCorrelation": { "$ref": "https://forgerail.dev/schemas/phase-slice-correlation-v1.json" },
    "exercisedOperationGrantIds": { "type": "array", "items": { "type": "string", "pattern": "^[a-zA-Z0-9][a-zA-Z0-9._:-]+$" }, "uniqueItems": true },
    "changedScope": { "type": "array", "items": { "type": "string", "minLength": 1 }, "uniqueItems": true },
    "validationEvidenceIdentityIds": { "type": "array", "items": { "type": "string", "pattern": "^[a-zA-Z0-9][a-zA-Z0-9._:-]+$" }, "uniqueItems": true },
    "externalSideEffects": {
      "type": "array",
      "items": {
        "type": "object",
        "additionalProperties": false,
        "required": ["operationId", "targetLocator", "observedAt"],
        "properties": {
          "operationId": { "type": "string", "pattern": "^[a-zA-Z0-9][a-zA-Z0-9._:-]+$" },
          "targetLocator": { "type": "string", "minLength": 1 },
          "observedAt": { "type": "string", "format": "date-time" }
        }
      }
    },
    "confirmedNonMutations": { "type": "array", "items": { "type": "string", "minLength": 1 }, "uniqueItems": true },
    "residualRisks": { "type": "array", "items": { "type": "string", "minLength": 1 }, "uniqueItems": true },
    "rollbackEnvelopeLineageId": { "type": ["string", "null"], "pattern": "^[a-zA-Z0-9][a-zA-Z0-9._:-]+$" },
    "deviations": { "type": "array", "items": { "type": "string", "minLength": 1 }, "uniqueItems": true },
    "claimStatus": { "enum": ["claimed", "verified", "rejected", "stale"] },
    "verificationGateResultId": { "type": ["string", "null"], "pattern": "^[a-zA-Z0-9][a-zA-Z0-9._:-]+$" },
    "closeout": { "enum": ["complete", "incomplete", "blocked"] },
    "claimedAt": { "type": "string", "format": "date-time" }
  },
  "allOf": [
    {
      "if": { "properties": { "claimStatus": { "const": "verified" } }, "required": ["claimStatus"] },
      "then": { "properties": { "verificationGateResultId": { "type": "string" } } }
    },
    {
      "if": { "properties": { "closeout": { "const": "complete" } }, "required": ["closeout"] },
      "then": { "properties": { "claimStatus": { "const": "verified" }, "verificationGateResultId": { "type": "string" }, "deviations": { "maxItems": 0 } } }
    }
  ]
}
