{
  "schemaVersion": "2.0",
  "receiptId": "receipt:task-2.6-changed-subject",
  "taskId": "task:2.6",
  "workspaceIdentityId": "workspace:echopath",
  "profileId": "profile:forgerail",
  "profileRevisionId": "profile-revision:forgerail-2.5",
  "envelopeId": "envelope:task-2.6",
  "envelopeRevisionId": "envelope-revision:task-2.6-1",
  "controlRevisionId": "control-revision:task-2.6-2",
  "subjectId": "subject:task-2.6-rewritten",
  "phaseSliceCorrelation": {
    "schemaVersion": "1.0",
    "correlationId": "correlation:task-2.6",
    "taskId": "task:2.6",
    "parentTaskId": "task:forgerail-control-system",
    "phaseId": "phase:contracts",
    "sliceId": "slice:task-2.6",
    "executionAttemptId": "attempt:task-2.6-2",
    "ownerWorkspaceIdentityId": "workspace:echopath",
    "requiredSliceIds": ["slice:task-2.6"],
    "aggregateClosureClaim": false
  },
  "exercisedOperationGrantIds": ["grant:task-2.6-write"],
  "changedScope": ["plugins/forgerail/contracts"],
  "validationEvidenceIdentityIds": ["evidence:task-2.6-tests-rewritten"],
  "externalSideEffects": [],
  "confirmedNonMutations": ["No public projection", "No remote operation"],
  "residualRisks": [],
  "rollbackEnvelopeLineageId": null,
  "deviations": [],
  "claimStatus": "verified",
  "verificationGateResultId": "gate-result:task-2.6-receipt-rewritten",
  "closeout": "complete",
  "claimedAt": "2026-08-19T16:45:00Z"
}
